{
  "schemaVersion": 1,
  "coverage": "partial",
  "acceptancePolicy": "requirements-only-no-functional-verdict",
  "snapshot": {
    "commit": "556fdad7e4d4955e988dd198f5ffe0db0a19ae81",
    "tree": "5cc9ef72856730ea30ea6487ffdc96dc6d9209ce",
    "registry": {
      "path": "data/registry/canonical-registry.json",
      "gitBlob": "867453e229261e6137fc219053fca92d29c2e03c",
      "bytes": 6491543,
      "sha256": "6a5ebe735c809f56efe45f35e4677b3f8ad5efef9768d06c0d6b2c1caaa1abcf"
    },
    "rawRegistry": {
      "path": "assets/js/components/tool-registry.js",
      "gitBlob": "925db513a3ca9184f72c44956a9efd8f717b11f6",
      "bytes": 1716994,
      "sha256": "2e7d2b55018f78530ba071b012901c179b5ef50be5d6bfeef97ee3fbdd7d1d51"
    },
    "expectedCounts": {
      "raw": 3698,
      "eligible": 3689,
      "english": 1256,
      "localized": 2433,
      "freeEnglish": 457,
      "freeAndProEnglish": 799,
      "separateProApps": 11
    },
    "exclusions": [
      {
        "id": "generator-fuel-african",
        "route": "/tools/generator-fuel/",
        "reason": "redirect"
      },
      {
        "id": "minimum-wage-legal",
        "route": "/tools/minimum-wage/",
        "reason": "redirect"
      },
      {
        "id": "remittance-v2",
        "route": "/tools/remittance-compare/",
        "reason": "redirect"
      },
      {
        "id": "afrotools-pro",
        "route": "/pro/",
        "reason": "english-pro-landing"
      },
      {
        "id": "vat-calculator",
        "route": "/tools/vat-calculator/",
        "reason": "redirect"
      },
      {
        "id": "crypto-tax",
        "route": "/tools/crypto-tax/",
        "reason": "redirect"
      },
      {
        "id": "transfert-v2-fr",
        "route": "/fr/tools/transfert-argent/",
        "reason": "redirect"
      },
      {
        "id": "salary-tax-sw",
        "route": "/sw/mshahara-na-kodi/",
        "reason": "redirect"
      },
      {
        "id": "prepaid-meter",
        "route": "/tools/electricity-tariff/",
        "reason": "unpublished-compatibility"
      }
    ]
  },
  "families": [
    {
      "appFamilyId": "cv-builder",
      "label": "CV Builder",
      "workflow": "Create or import a CV, edit its sections and prepare a local document export.",
      "freeCore": "Normalized catalogue availability is free. The proposed task scope is not exercised guest-access or all-feature-free proof.",
      "identityReview": "proposed",
      "membershipClosure": "partial",
      "sourceEvidence": [
        {
          "pin": {
            "path": "tools/cv-builder/index.html",
            "gitBlob": "24a69786e06a2f72bef6048b219e735225dd771b",
            "bytes": 66256,
            "sha256": "963c2095ab71272053296296c79187768b1c43bb2b289c8e4b74f0466eb8d382"
          },
          "kind": "page-owner",
          "literal": "Build My CV",
          "scope": "Exact current D task/control declaration; no executed workflow or authorization verdict."
        }
      ],
      "ambiguityKeys": [
        "review-cv-builder"
      ]
    },
    {
      "appFamilyId": "vat-calc-pan-african",
      "label": "VAT planning calculator",
      "workflow": "Calculate added or extracted VAT and local invoice-planning scenarios with an explicit user-entered rate.",
      "freeCore": "Normalized catalogue availability is free. The proposed task scope is not exercised guest-access or all-feature-free proof.",
      "identityReview": "proposed",
      "membershipClosure": "partial",
      "sourceEvidence": [
        {
          "pin": {
            "path": "tools/vat-calculator/index.html",
            "gitBlob": "23a3b0a4ab7997deb16019b2c82b156bae9bfae1",
            "bytes": 20420,
            "sha256": "38b0a78cb9afdd71b71bcaacd064efb4e9db2ba7590aa8fbe8d06231683c3cc6"
          },
          "kind": "page-owner",
          "literal": "Calculate VAT",
          "scope": "Exact current D task/control declaration; no executed workflow or authorization verdict."
        },
        {
          "pin": {
            "path": "assets/js/pages/pan-african-vat-vip.js",
            "gitBlob": "40c8ab7c21282da66b2093afd232560f23323ec3",
            "bytes": 22695,
            "sha256": "4990088149db58af75acdf611f40b37c52ed178fdcd4ae863f1ab1fbab74c6ae"
          },
          "kind": "engine-entrypoint",
          "literal": "function",
          "scope": "Existing r24 declared implementation entrypoint, repinned atD; shared code never implies family equivalence."
        }
      ],
      "ambiguityKeys": [
        "review-vat-calc-pan-african"
      ]
    },
    {
      "appFamilyId": "stock-portfolio",
      "label": "Stock portfolio tracker",
      "workflow": "Enter holdings and user-supplied prices, then calculate a manual portfolio valuation.",
      "freeCore": "Normalized catalogue availability is free-and-pro. The proposed task scope is not exercised guest-access or all-feature-free proof.",
      "identityReview": "proposed",
      "membershipClosure": "partial",
      "sourceEvidence": [
        {
          "pin": {
            "path": "tools/stock-portfolio/index.html",
            "gitBlob": "1f5172b2b325cdd7b934ecd50d841f1fa5049c9c",
            "bytes": 19965,
            "sha256": "4f76f8e7db3553bea9b600c30900466ada1042cbdfab3d2866bbce2ab4afabff"
          },
          "kind": "page-owner",
          "literal": "Calculate Portfolio Value",
          "scope": "Exact current D task/control declaration; no executed workflow or authorization verdict."
        },
        {
          "pin": {
            "path": "assets/js/pages/fintech-shared-controllers/stock-portfolio.js",
            "gitBlob": "c2e5494442bd85035cf9d27999d221a2ce673ee7",
            "bytes": 6716,
            "sha256": "5a5333f06940e126118febe225b82fb7526337b6aa389a8c454d5c4ae3e7ba28"
          },
          "kind": "engine-entrypoint",
          "literal": "function",
          "scope": "Existing r24 declared implementation entrypoint, repinned atD; shared code never implies family equivalence."
        }
      ],
      "ambiguityKeys": [
        "review-stock-portfolio"
      ]
    },
    {
      "appFamilyId": "pdf-merge-split",
      "label": "PDF merge/split export",
      "workflow": "Combine PDFs or split/extract pages locally; combined product identity remains proposed, not a merge of all PDF tools.",
      "freeCore": "Normalized catalogue availability is free-and-pro. The proposed task scope is not exercised guest-access or all-feature-free proof.",
      "identityReview": "proposed",
      "membershipClosure": "partial",
      "sourceEvidence": [
        {
          "pin": {
            "path": "tools/pdf-merge-split/index.html",
            "gitBlob": "a35a575a25546a6af40833e06ff0b69e6d80772c",
            "bytes": 35074,
            "sha256": "a5106d9ad2dcdddb948866779319afa923bf9cbbc62b966cf115bbff1f2b8589"
          },
          "kind": "page-owner",
          "literal": "Merge PDFs",
          "scope": "Exact current D task/control declaration; no executed workflow or authorization verdict."
        },
        {
          "pin": {
            "path": "tools/pdf-merge-split/app.js",
            "gitBlob": "dc2b8e0aa4a76dedaf84f22a1b3d41a867bfe174",
            "bytes": 23136,
            "sha256": "3bb0a2a712f06001778f942e5e0dd5c7e4f603ed6a55cf9e04789201bcd2b364"
          },
          "kind": "engine-entrypoint",
          "literal": "function",
          "scope": "Existing r24 declared implementation entrypoint, repinned atD; shared code never implies family equivalence."
        }
      ],
      "ambiguityKeys": [
        "review-pdf-merge-split"
      ]
    },
    {
      "appFamilyId": "image-to-text",
      "label": "Image-to-text OCR",
      "workflow": "Load images and request local OCR into editable text, then review/copy/export the result.",
      "freeCore": "Normalized catalogue availability is free-and-pro. The proposed task scope is not exercised guest-access or all-feature-free proof.",
      "identityReview": "proposed",
      "membershipClosure": "partial",
      "sourceEvidence": [
        {
          "pin": {
            "path": "tools/image-to-text/index.html",
            "gitBlob": "d56ab531d1ab45b37aa365931a719259d77e89cb",
            "bytes": 27772,
            "sha256": "cbf8a85bd8aab9c9b99239486248c91bfb385b62dc01b9d72779b726bc6585a6"
          },
          "kind": "page-owner",
          "literal": "Extract text",
          "scope": "Exact current D task/control declaration; no executed workflow or authorization verdict."
        },
        {
          "pin": {
            "path": "assets/js/lib/image-to-text-ocr-local.js",
            "gitBlob": "f1c172eae6b7035568c5e6d303d97f7142648a44",
            "bytes": 1067,
            "sha256": "f07cf7e117bad327cf1a134196855131bd34055ee51fa8f4d3c19e55ae3924cd"
          },
          "kind": "engine-entrypoint",
          "literal": "function",
          "scope": "Existing r24 declared implementation entrypoint, repinned atD; shared code never implies family equivalence."
        }
      ],
      "ambiguityKeys": [
        "review-image-to-text"
      ]
    },
    {
      "appFamilyId": "image-format-convert",
      "label": "Image format converter",
      "workflow": "Load an image, select supported output formats/options and prepare local converted downloads.",
      "freeCore": "Normalized catalogue availability is free-and-pro. The proposed task scope is not exercised guest-access or all-feature-free proof.",
      "identityReview": "proposed",
      "membershipClosure": "partial",
      "sourceEvidence": [
        {
          "pin": {
            "path": "tools/image-format-convert/index.html",
            "gitBlob": "75acddeeef079e53b10ad5853fc277be24bb34af",
            "bytes": 23845,
            "sha256": "c200d42f875537e9d503b02b8adc72f9e3df628487404222fa8ced438a514828"
          },
          "kind": "page-owner",
          "literal": "Convert current",